{"schema_version":"thieucubu.weekly_bottom_watch.v3","score_version":"thieucubu.weekly_bottom_watch.score.v3","updated_at":"2026-10-24T13:39:39+07:00","policy":{"advisory_only":true,"max_candidates":5,"requires":["weekly_SMIIO_2_or_3_bottoms","deep_discount","weekly_momentum_turning_or_divergence"],"score_100":{"weekly_SMIIO_bottoms":"2=40, 3=50","daily_SMIIO_bottoms":"1=5, 2_or_3=10","momentum_divergence":15,"money_flow_divergence":15,"discount_structure":10},"smiio_profiles":{"1W":"5/20/5_standard","1D":"3/13/3_sensitive"},"money_flow_divergence":"price_lower_low_with_OBV_CMF_MFI_flat_or_rising","never_average_below_invalidation":true},"candidates":[{"symbol":"VCI","sector":"Chung khoan","close":19.6,"score":97,"score_version":"thieucubu.weekly_bottom_watch.score.v3","score_components":{"weekly_smiio_bottoms":50,"daily_smiio_bottoms":10,"momentum_divergence":15,"money_flow_divergence":15,"discount_structure":7},"confidence":88,"label":"W-PRE-SMIIO-3","stage":"FORMING_STRONG","action":"CANH THĂM DÒ 1/6 SAU XÁC NHẬN","probe_fraction":0.15,"bottom_count":3,"oscillator_type":"SMI_ERGODIC_OSCILLATOR","weekly_smiio_bottom_count":3,"daily_smiio_bottom_count":3,"weekly_smiio_profile":{"short_period":5,"long_period":20,"signal_period":5},"daily_smiio_profile":{"short_period":3,"long_period":13,"signal_period":3},"weekly_smi_bottom_count":3,"daily_smi_bottom_count":3,"price_bottom_count":2,"discount_104w_pct":45.31,"target_discount_pct":35.0,"technical_score":88,"flow_score":39,"flow_divergence_score":15,"structure_score":45,"structure_state":"DISCOUNT_WATCH","rsi":38.0,"macd_hist_pct":-0.766,"smi":-64.2,"smiio":0.079,"ergodic":-31.315,"ergodic_signal":-31.393,"weekly_smiio_state":"ZERO_CROSS_UP","daily_smiio_state":"FADING_POSITIVE","weekly_smi_state":"ZERO_CROSS_UP","daily_smi_state":"FADING_POSITIVE","weekly_macd_state":"PRE_CROSS_NEGATIVE","daily_macd_state":"RECOVERING_NEGATIVE","macd_zone":"NEGATIVE","macd_divergence_state":"NONE","smiio_zone":"POSITIVE","smiio_divergence_state":"BULLISH_POSITIVE","obv_state":"YẾU","cmf20":-0.07,"mfi14":48.4,"trigger_price":23.2,"invalidation_price":17.51,"risk_to_invalidation_pct":10.66,"pivot_dates":["2026-06-12","2026-07-24","2026-10-09"],"pivot_prices":[23.6,19.8,18.55],"weekly_smiio_pivot_dates":["2026-06-12","2026-07-24","2026-10-09"],"weekly_smiio_pivot_values":[-8.449,-9.76,-5.02],"daily_smiio_pivot_dates":["2026-09-11","2026-10-02","2026-10-13"],"weekly_smi_pivot_dates":["2026-06-12","2026-07-24","2026-10-09"],"weekly_smi_pivot_values":[-8.449,-9.76,-5.02],"daily_smi_pivot_dates":["2026-09-11","2026-10-02","2026-10-13"],"flow_divergence_signals":["Giá tạo đáy thấp hơn nhưng OBV đi ngang/tăng","Giá giảm nhưng CMF không giảm theo","Giá giảm nhưng MFI giữ ngang/tăng"],"signals":["Chiết khấu 104W 45.3%","SMIIO 3 đáy 1W","SMIIO 1W vừa cắt lên 0","SMIIO 1W phân kỳ tăng","SMIIO 3 đáy 1D","SMIIO 1D phân kỳ tăng","MACD tuần PRE_CROSS_NEGATIVE","SMIIO tuần ZERO_CROSS_UP"],"risk_note":"Thủng 17.51: hủy kịch bản; không bình quân giá xuống","price_data_source":"VCI","history_backfill_source":null,"cache_status":"live"},{"symbol":"DBC","sector":"Nong nghiep chan nuoi","close":16.45,"score":96,"score_version":"thieucubu.weekly_bottom_watch.score.v3","score_components":{"weekly_smiio_bottoms":50,"daily_smiio_bottoms":10,"momentum_divergence":14,"money_flow_divergence":15,"discount_structure":7},"confidence":89,"label":"W-PRE-SMIIO-3","stage":"CONFIRMED","action":"CANH THĂM DÒ 1/6 SAU XÁC NHẬN","probe_fraction":0.15,"bottom_count":3,"oscillator_type":"SMI_ERGODIC_OSCILLATOR","weekly_smiio_bottom_count":3,"daily_smiio_bottom_count":3,"weekly_smiio_profile":{"short_period":5,"long_period":20,"signal_period":5},"daily_smiio_profile":{"short_period":3,"long_period":13,"signal_period":3},"weekly_smi_bottom_count":3,"daily_smi_bottom_count":3,"price_bottom_count":2,"discount_104w_pct":42.26,"target_discount_pct":38.0,"technical_score":88,"flow_score":69,"flow_divergence_score":15,"structure_score":64,"structure_state":"DISCOUNT_WATCH","rsi":40.6,"macd_hist_pct":0.766,"smi":-47.0,"smiio":6.009,"ergodic":-29.68,"ergodic_signal":-35.69,"weekly_smiio_state":"ZERO_CROSS_UP","daily_smiio_state":"ACCELERATING_POSITIVE","weekly_smi_state":"ZERO_CROSS_UP","daily_smi_state":"ACCELERATING_POSITIVE","weekly_macd_state":"RECOVERING_NEGATIVE","daily_macd_state":"IMPROVING_POSITIVE","macd_zone":"NEGATIVE","macd_divergence_state":"NONE","smiio_zone":"POSITIVE","smiio_divergence_state":"BULLISH_POSITIVE","obv_state":"TĂNG","cmf20":-0.069,"mfi14":46.3,"trigger_price":17.79,"invalidation_price":14.78,"risk_to_invalidation_pct":10.15,"pivot_dates":["2026-05-29","2026-07-24","2026-10-02"],"pivot_prices":[18.94,16.1,15.4],"weekly_smiio_pivot_dates":["2026-05-29","2026-07-24","2026-10-02"],"weekly_smiio_pivot_values":[-4.533,-5.94,-0.903],"daily_smiio_pivot_dates":["2026-09-11","2026-10-01","2026-10-13"],"weekly_smi_pivot_dates":["2026-05-29","2026-07-24","2026-10-02"],"weekly_smi_pivot_values":[-4.533,-5.94,-0.903],"daily_smi_pivot_dates":["2026-09-11","2026-10-01","2026-10-13"],"flow_divergence_signals":["Giá tạo đáy thấp hơn nhưng OBV đi ngang/tăng","Giá giảm nhưng CMF không giảm theo","Giá giảm nhưng MFI giữ ngang/tăng"],"signals":["Chiết khấu 104W 42.3%","SMIIO 3 đáy 1W","SMIIO 1W vừa cắt lên 0","SMIIO 1W phân kỳ tăng","SMIIO 3 đáy 1D","MACD tuần RECOVERING_NEGATIVE","SMIIO tuần ZERO_CROSS_UP","Giá tạo đáy thấp hơn nhưng OBV đi ngang/tăng"],"risk_note":"Thủng 14.78: hủy kịch bản; không bình quân giá xuống","price_data_source":"VCI","history_backfill_source":null,"cache_status":"live"},{"symbol":"HPG","sector":"Thep","close":20.95,"score":95,"score_version":"thieucubu.weekly_bottom_watch.score.v3","score_components":{"weekly_smiio_bottoms":50,"daily_smiio_bottoms":10,"momentum_divergence":14,"money_flow_divergence":15,"discount_structure":6},"confidence":88,"label":"W-PRE-SMIIO-3","stage":"FORMING_STRONG","action":"CANH THĂM DÒ 1/6 SAU XÁC NHẬN","probe_fraction":0.15,"bottom_count":3,"oscillator_type":"SMI_ERGODIC_OSCILLATOR","weekly_smiio_bottom_count":3,"daily_smiio_bottom_count":3,"weekly_smiio_profile":{"short_period":5,"long_period":20,"signal_period":5},"daily_smiio_profile":{"short_period":3,"long_period":13,"signal_period":3},"weekly_smi_bottom_count":3,"daily_smi_bottom_count":3,"price_bottom_count":2,"discount_104w_pct":23.93,"target_discount_pct":25.0,"technical_score":97,"flow_score":57,"flow_divergence_score":15,"structure_score":67,"structure_state":"DISCOUNT_WATCH","rsi":41.5,"macd_hist_pct":-0.305,"smi":-44.1,"smiio":2.627,"ergodic":-24.434,"ergodic_signal":-27.06,"weekly_smiio_state":"ZERO_CROSS_UP","daily_smiio_state":"ZERO_CROSS_DOWN","weekly_smi_state":"ZERO_CROSS_UP","daily_smi_state":"ZERO_CROSS_DOWN","weekly_macd_state":"PRE_CROSS_NEGATIVE","daily_macd_state":"WEAKENING_POSITIVE","macd_zone":"NEGATIVE","macd_divergence_state":"NONE","smiio_zone":"POSITIVE","smiio_divergence_state":"BULLISH_POSITIVE","obv_state":"CẢI THIỆN","cmf20":-0.268,"mfi14":46.0,"trigger_price":22.7,"invalidation_price":19.39,"risk_to_invalidation_pct":7.45,"pivot_dates":["2026-06-12","2026-07-24","2026-10-09"],"pivot_prices":[23.2,20.8,20.1],"weekly_smiio_pivot_dates":["2026-06-12","2026-07-24","2026-10-09"],"weekly_smiio_pivot_values":[-6.957,-13.415,-4.589],"daily_smiio_pivot_dates":["2026-09-28","2026-10-09","2026-10-19"],"weekly_smi_pivot_dates":["2026-06-12","2026-07-24","2026-10-09"],"weekly_smi_pivot_values":[-6.957,-13.415,-4.589],"daily_smi_pivot_dates":["2026-09-28","2026-10-09","2026-10-19"],"flow_divergence_signals":["Giá tạo đáy thấp hơn nhưng OBV đi ngang/tăng","Giá giảm nhưng CMF không giảm theo","Giá giảm nhưng MFI giữ ngang/tăng"],"signals":["Chiết khấu 104W 23.9%","SMIIO 3 đáy 1W","SMIIO 1W vừa cắt lên 0","SMIIO 1W phân kỳ tăng","SMIIO 3 đáy 1D","MACD tuần PRE_CROSS_NEGATIVE","SMIIO tuần ZERO_CROSS_UP","Giá tạo đáy thấp hơn nhưng OBV đi ngang/tăng"],"risk_note":"Thủng 19.39: hủy kịch bản; không bình quân giá xuống","price_data_source":"VCI","history_backfill_source":null,"cache_status":"live"},{"symbol":"PDR","sector":"BDS dan cu","close":12.15,"score":93,"score_version":"thieucubu.weekly_bottom_watch.score.v3","score_components":{"weekly_smiio_bottoms":50,"daily_smiio_bottoms":10,"momentum_divergence":15,"money_flow_divergence":10,"discount_structure":8},"confidence":89,"label":"W-PRE-SMIIO-3","stage":"CONFIRMED","action":"CANH THĂM DÒ 1/6 SAU XÁC NHẬN","probe_fraction":0.15,"bottom_count":3,"oscillator_type":"SMI_ERGODIC_OSCILLATOR","weekly_smiio_bottom_count":3,"daily_smiio_bottom_count":3,"weekly_smiio_profile":{"short_period":5,"long_period":20,"signal_period":5},"daily_smiio_profile":{"short_period":3,"long_period":13,"signal_period":3},"weekly_smi_bottom_count":3,"daily_smi_bottom_count":3,"price_bottom_count":2,"discount_104w_pct":55.33,"target_discount_pct":43.0,"technical_score":93,"flow_score":39,"flow_divergence_score":10,"structure_score":50,"structure_state":"NO_SETUP","rsi":39.0,"macd_hist_pct":1.039,"smi":-42.7,"smiio":7.823,"ergodic":-38.639,"ergodic_signal":-46.462,"weekly_smiio_state":"ZERO_CROSS_UP","daily_smiio_state":"FADING_POSITIVE","weekly_smi_state":"ZERO_CROSS_UP","daily_smi_state":"FADING_POSITIVE","weekly_macd_state":"BULL_CROSS_NEGATIVE","daily_macd_state":"IMPROVING_POSITIVE","macd_zone":"NEGATIVE","macd_divergence_state":"NONE","smiio_zone":"POSITIVE","smiio_divergence_state":"BULLISH_POSITIVE","obv_state":"YẾU","cmf20":-0.093,"mfi14":54.8,"trigger_price":12.98,"invalidation_price":10.57,"risk_to_invalidation_pct":13.0,"pivot_dates":["2026-03-20","2026-07-31","2026-10-02"],"pivot_prices":[15.15,11.45,11.2],"weekly_smiio_pivot_dates":["2026-03-20","2026-07-31","2026-10-02"],"weekly_smiio_pivot_values":[-5.039,-10.892,-1.767],"daily_smiio_pivot_dates":["2026-09-14","2026-09-25","2026-10-14"],"weekly_smi_pivot_dates":["2026-03-20","2026-07-31","2026-10-02"],"weekly_smi_pivot_values":[-5.039,-10.892,-1.767],"daily_smi_pivot_dates":["2026-09-14","2026-09-25","2026-10-14"